{"alternative_hypotheses":[{"hypothesis":"AMDは決算または売上見通しが通常予想を下回ったため下落した。","id":"ALT-01","status":"rejected","supporting_evidence_ids":[],"weakening_evidence_ids":["E-004"]},{"hypothesis":"NASDAQの0.83%下落はAMD一社だけで説明できる。","id":"ALT-02","status":"weakened","supporting_evidence_ids":["E-001"],"weakening_evidence_ids":["E-001","E-008"]},{"hypothesis":"米国株全体の一様なリスクオフがすべてを説明した。","id":"ALT-03","status":"weakened","supporting_evidence_ids":["E-001"],"weakening_evidence_ids":["E-001","E-008"]},{"hypothesis":"金利またはVIXがNASDAQ下落の主要因だった。","id":"ALT-04","status":"unresolved","supporting_evidence_ids":[],"weakening_evidence_ids":["E-009"]}],"causal_edges":[{"confidence":"high","editorially_required":true,"evidence_ids":["E-004"],"from_node":"AMD Q3売上見通し約130億ドル","id":"EDGE-01","mechanism":"Reuters記載の市場予想約125.2億ドルを約4.8億ドル上回った。","scope":"company_direct","strongest_alternative":"予想集計方法の差","timing_alignment":"strong","to_node":"通常の数値予想を上回る"},{"confidence":"medium","editorially_required":true,"evidence_ids":["E-004","E-005","E-001"],"from_node":"高まったAI競争期待と追加証拠不足","id":"EDGE-02","mechanism":"通常の売上予想超過だけでは、大型顧客、利益率、AI投資回収への要求を満たさなかったとの市場解釈。","scope":"company_direct","strongest_alternative":"AMD固有の利益率・供給制約だけで説明できる可能性","timing_alignment":"partial","to_node":"AMD株の下落評価"},{"confidence":"medium","editorially_required":true,"evidence_ids":["E-006","E-007","E-001"],"from_node":"SpaceXのNVIDIA専属採用報道","id":"EDGE-03","mechanism":"NVIDIAには次の巨大需要に関する具体的な採用証拠が加わり、AMDには同等の証拠が示されなかった。","scope":"sector_support","strongest_alternative":"NVIDIA上昇に他の企業固有材料が寄与した可能性","timing_alignment":"partial","to_node":"NVIDIAとAMDの相対評価分岐"},{"confidence":"medium","editorially_required":true,"evidence_ids":["E-001","E-008"],"from_node":"半導体安と大型テック安","id":"EDGE-04","mechanism":"SOXX、AMD、Alphabet、Microsoftの下落が重なり、AMD一社ではなく複数の大型テック・半導体材料がNASDAQの下落側に並んだ。","scope":"nasdaq_wide","strongest_alternative":"未取得の金利・ボラティリティ要因が共通原因だった可能性","timing_alignment":"strong","to_node":"Nasdaq Composite 0.83%下落"}],"contract_version":"0.2.0","contradictions":[{"id":"CON-01","rank":1,"selection_reason":"好決算と株価下落の矛盾が、昨夜のAI半導体市場の評価軸を最もよく説明するため。","statement":"AMDはQ3売上見通しで通常のアナリスト予想を上回ったのに、8月5日の通常取引で7.04%下落した。"},{"id":"CON-02","rank":2,"selection_reason":"AI需要全体ではなく、受注証拠と競争上の確度が銘柄を分けた可能性を検証できるため。","statement":"同じAI半導体でもNVIDIAは3.43%上昇し、AMDは7.04%下落した。"},{"id":"CON-03","rank":3,"selection_reason":"AMD一社や全面的なリスクオフへ原因を単純化しないため。","statement":"Nasdaq Compositeは0.83%下落した一方、Dowは上昇し、米国株全面安ではなかった。"}],"contrary_evidence":[{"effect_on_confidence":"material","evidence_ids":["E-004"],"statement":"AMDのQ3売上見通しは通常の市場予想を上回った。"},{"effect_on_confidence":"material","evidence_ids":["E-001"],"statement":"NVIDIAは3.43%上昇しており、AI半導体全面安ではない。"},{"effect_on_confidence":"minor","evidence_ids":["E-008"],"statement":"Dowは上昇しており、米国株全面安ではない。"},{"effect_on_confidence":"material","evidence_ids":["E-009"],"statement":"金利、VIX、QQQ、SMH、分足が不足し、マクロ要因と瞬間的な寄与は確定できない。"}],"editorial_handoff":{"causal_spine":"AMDの通常予想超過→高まったAI期待に対する追加証拠不足→SpaceX採用でNVIDIAとの相対差が拡大→半導体安と大型テック安が重なりNASDAQ下落","central_hypothesis":"昨夜のAI半導体市場は需要の有無ではなく、次の巨大需要を誰が確実に取るかを評価し、通常予想を超えたAMDよりSpaceXの採用証拠を得たNVIDIAを高く評価した。","company_direct_material":["AMD Q2売上115.4億ドル","データセンター売上67.2億ドル","Q3売上見通し約130億ドル","AMD 7.04%下落"],"confidence":"medium","exclude_from_narration":["AMD一社がNASDAQ下落の唯一の原因という断定","分足がない状態での発言直後の値動き断定","金利またはVIXを確認済み主因とする表現","2026-07-31回の仮説を当日の現在証拠として使うこと"],"headline_beyond_discovery":"好決算かどうかではなく、次の巨大需要を取った証拠があるかがAI半導体の評価を分けた。","memory_differences":["2026-07-31回はAWSのAI投資回収を扱ったが、当日は競争上の採用証拠が中心であり、過去回は現在因果へ使用しなかった。"],"nasdaq_wide_material":["SOXX 2.12%下落","Alphabet 4.03%下落","Microsoft 1.09%下落","Nasdaq Composite 0.83%下落"],"next_validation_points":["AMDの大型顧客獲得","粗利率とN3・CoWoS供給制約の改善","SOXX上昇がNVIDIA以外へ広がるか"],"provisional_lead":"AMDの好決算後下落","unresolved_questions":["金利・VIX・QQQ・SMHの寄与","SpaceX発言ごとの分足反応","AMDが今後SpaceX級の大型顧客を獲得するか"]},"episode_date":"2026-08-06","evidence":[{"claim":"2026年8月5日の終値ベースでNasdaq Compositeは0.83%安、SOXXは2.12%安、NVIDIAは3.43%高、AMDは7.04%安、Alphabetは4.03%安、Microsoftは1.09%安だった。","confidence":"high","directness":"direct","event_timestamp":"2026-08-05T16:00:00-04:00","evidence_class":"fact","evidence_id":"E-001","independence_group":"market-close-data","limitations":"終値データ。分足と指数寄与度の詳細は含まれない。","publication_timestamp":"2026-08-06T04:27:46+00:00","source_issuer_or_publisher":"朝のNASDAQカフェ source collector","source_reference":"daily-inputs/2026-08-06/daily_source_package_2026-08-06.md#market-data","source_tier":"tier_1","source_title":"NASDAQ Cafe Source Pack 2026-08-06","timezone":"America/New_York"},{"claim":"AMDは前四半期時点でQ2売上110億〜115億ドル、中心112億ドル、非GAAP粗利率56%を見込んでいた。","confidence":"high","directness":"direct","event_timestamp":"2026-05-05T16:15:00-04:00","evidence_class":"fact","evidence_id":"E-002","independence_group":"amd-ir-q1-2026","limitations":"Q2発表前の会社見通しであり、アナリストコンセンサスではない。","publication_timestamp":"2026-05-05T20:15:00+00:00","source_issuer_or_publisher":"AMD Investor Relations","source_reference":"https://ir.amd.com/news-events/press-releases/detail/1284/amd-reports-first-quarter-2026-financial-results","source_tier":"tier_1","source_title":"AMD Reports First Quarter 2026 Financial Results","timezone":"America/New_York"},{"claim":"AMDは2026年8月4日の市場引け後にQ2決算を発表し、17時ETに説明会を開催すると告知していた。","confidence":"high","directness":"direct","event_timestamp":"2026-08-04T17:00:00-04:00","evidence_class":"fact","evidence_id":"E-003","independence_group":"amd-ir-q2-schedule","limitations":"発表時刻の根拠であり、株価反応の原因を単独で示さない。","publication_timestamp":"2026-07-08T20:15:00+00:00","source_issuer_or_publisher":"AMD Investor Relations","source_reference":"https://ir.amd.com/news-events/press-releases/detail/1289/amd-to-report-fiscal-second-quarter-2026-financial-results","source_tier":"tier_1","source_title":"AMD to Report Fiscal Second Quarter 2026 Financial Results","timezone":"America/New_York"},{"claim":"ReutersはAMDのQ2売上115.4億ドル、データセンター売上67.2億ドル、Q3売上見通し約130億ドル、市場予想約125.2億ドル、引け後約9%下落を報じた。","confidence":"high","directness":"direct","event_timestamp":"2026-08-04T16:00:00-04:00","evidence_class":"fact","evidence_id":"E-004","independence_group":"reuters-amd-results-2026-08-04","limitations":"市場予想は報道に記載された集計値。正確な分足反応は保持していない。","publication_timestamp":"2026-08-04T20:00:00+00:00","source_issuer_or_publisher":"Reuters","source_reference":"https://www.reuters.com/business/amd-forecasts-upbeat-revenue-ai-data-center-demand-beats-quarterly-estimates-2026-08-04/","source_tier":"tier_2","source_title":"AMD's AI-powered revenue forecast fails to wow investors","timezone":"America/New_York"},{"claim":"Reutersは、通常予想を超えたにもかかわらず、投資家がより大きなAI投資回収、大型顧客、利益率の証拠を求めたとの市場解釈を報じた。","confidence":"medium","directness":"direct","event_timestamp":"2026-08-05T12:00:00-04:00","evidence_class":"reported_interpretation","evidence_id":"E-005","independence_group":"reuters-amd-reaction-2026-08-05","limitations":"市場参加者の共有解釈であり、単独の確定原因ではない。","publication_timestamp":"2026-08-05T16:00:00+00:00","source_issuer_or_publisher":"Reuters","source_reference":"https://www.reuters.com/business/amd-falls-investors-seek-bigger-ai-payoff-2026-08-05/","source_tier":"tier_2","source_title":"AMD falls as investors demand bigger AI payoff","timezone":"America/New_York"},{"claim":"SpaceXは2026年8月4日16時30分ETにQ2説明会を開催すると告知していた。","confidence":"high","directness":"direct","event_timestamp":"2026-08-04T16:30:00-04:00","evidence_class":"fact","evidence_id":"E-006","independence_group":"spacex-ir-q2-schedule","limitations":"説明会時刻の根拠。GPU採用内容そのものは主要報道で確認した。","publication_timestamp":"2026-07-20T00:00:00+00:00","source_issuer_or_publisher":"SpaceX Investor Relations","source_reference":"https://ir.spacex.com/updates/releases-details/2026/SpaceX-to-Post-Second-Quarter-2026-Results-and-Host-Webcast-on-August-4-2026-2026-g8layJlbFm/default.aspx","source_tier":"tier_1","source_title":"SpaceX to Post Second Quarter 2026 Results and Host Webcast on August 4, 2026","timezone":"America/New_York"},{"claim":"MarketWatchは、SpaceXがNVIDIA GPUだけを使用するとの発言と、それがNVIDIA株の支援材料になったとの解釈を報じた。","confidence":"medium","directness":"supporting","event_timestamp":"2026-08-04T16:30:00-04:00","evidence_class":"reported_interpretation","evidence_id":"E-007","independence_group":"marketwatch-nvidia-spacex","limitations":"報道による発言要約と株価解釈。NVIDIA上昇の全要因を示さない。","publication_timestamp":"2026-08-05T21:22:00+00:00","source_issuer_or_publisher":"MarketWatch","source_reference":"https://www.marketwatch.com/story/nvidias-stock-is-basking-in-the-glow-of-a-high-profile-endorsement-b7c48e7b","source_tier":"tier_2","source_title":"Nvidia's stock is basking in the glow of a high-profile endorsement","timezone":"America/New_York"},{"claim":"Associated PressはNASDAQの下落にAlphabetとMicrosoftの下落も重なり、Dowは上昇する混合相場だったと報じた。","confidence":"medium","directness":"supporting","event_timestamp":"2026-08-05T16:00:00-04:00","evidence_class":"reported_interpretation","evidence_id":"E-008","independence_group":"ap-us-market-2026-08-05","limitations":"市場全体の要約であり、指数寄与度を定量分解していない。","publication_timestamp":"2026-08-05T21:00:00+00:00","source_issuer_or_publisher":"Associated Press","source_reference":"https://apnews.com/article/53179dc1c0148c5afeb47379b8f5b5c5","source_tier":"tier_2","source_title":"US stocks hold near records on hopes of an agreement with Iran","timezone":"America/New_York"},{"claim":"当日収集パックでは分足、米国債利回り、VIX、QQQ、SMHなどの確認に不足または欠損が残った。","confidence":"high","directness":"context","event_timestamp":null,"evidence_class":"fact","evidence_id":"E-009","independence_group":"collector-availability","limitations":"データ欠損の記録であり、市場原因を支持する証拠ではない。","publication_timestamp":"2026-08-06T04:27:46+00:00","source_issuer_or_publisher":"朝のNASDAQカフェ source collector","source_reference":"daily-inputs/2026-08-06/daily_source_package_2026-08-06.md#missing-data","source_tier":"tier_3","source_title":"NASDAQ Cafe Source Pack 2026-08-06","timezone":"America/New_York"}],"expected_actual_gap":{"actual":{"evidence_ids":["E-004","E-001","E-007"],"statement":"AMDはQ3売上見通し約130億ドル、Q2売上115.4億ドル、データセンター67.2億ドルを示した一方、翌日AMDは7.04%下落し、SpaceXの専属採用証拠はNVIDIA側へ加